New Balance,training,http://nb.scene7.com/is/image/NB/mx624wn2_nb_02_i?$dw_temp_default_gallery$,"Some would say that the New Balance 624 cross-trainer couldn't get any better. And they would be wrong. Presenting the updated 624 with increased flexibility, enhanced cushioning and even wider widths than ever before (4E and 6E). Tech specs include an EVA footbed, IMEVA (Injection Molded EVA foam), ABZORB® cushioning, internal shank and our lightweight Phantom Liner. ","['White_with_Navy', 'Black']",Mens New Balance 624,$74.99
New Balance,training,http://nb.scene7.com/is/image/NB/mx40bc_nb_02_i?$dw_temp_default_gallery$,"As your intensity increases, you can rely on the support of the external heel clip, the traction of the Vibram® outsole, and the comfort of the breathable synthetic/mesh upper.","['Barracuda_with_Red', 'HiLite_with_DarkDenim_and_Steel', 'Grey', 'Black_with_HiLite_and_White']",Minimus 40 Trainer,$119.99
New Balance,training,http://nb.scene7.com/is/image/NB/mx20eb7_nb_02_i?$dw_temp_default_gallery$,"The Minimus 20v7 men's trainer delivers advanced comfort and ground feel, so you can keep your focus on crushing your goals.","['Black_with_White', 'Red_with_Castlerock', 'EnergyLime_with_Black_and_Bolt', 'MilitaryFoliageGreen_with_DarkGreen', 'Pacific_with_Pigment_and_White']",Minimus 20v7 Trainer,$99.99
New Balance,training,http://nb.scene7.com/is/image/NB/mx608v4b_nb_14_i?$dw_temp_default_gallery$,"The leather look you want meets the support and cushioning you need in the New Balance 608v4. You’ll love the full-length comfort of the premium ABZORB® cushioning, the dual-density collar foam that helps prevent irritation at your ankles, and the flexible outsole that helps you move more freely.","['Black', 'Grey', 'Navy', 'White_with_RoyalBlue', 'White_with_Navy']",Mens New Balance 608v4,$69.99 - $74.99
New Balance,training,http://nb.scene7.com/is/image/NB/mx818bh3_nb_02_i?$dw_temp_default_gallery$,"We may have given the 818 trainer a makeover, but it's still the same powerful men's training shoe that always fires on all cylinders.","['Pacific_with_White', 'Black_with_Gunmetal_and_White', 'Castlerock_with_White', 'DarkCovertGreen_with_SilverMint']",Fresh Foam 818v3,$74.99
New Balance,training,http://nb.scene7.com/is/image/NB/mxvadohi_nb_02_i?$dw_temp_default_gallery$,Level up your training sessions in this men's performance sneaker from New Balance.,"['Black_with_White_and_Magnet', 'TeamAwayGrey_with_Black_and_TeamRed', 'HiLite_with_Black']",Fresh Foam VAADU,$89.99
New Balance,training,http://nb.scene7.com/is/image/NB/mx857wn2_nb_02_i?$dw_temp_default_gallery$,"DRI-EX® lining helps wick moisture, while a durable leather upper keeps your look classic in and out of the gym.","['Black', 'White_with_Navy']",Mens New Balance 857v2,$124.99
New Balance,training,http://nb.scene7.com/is/image/NB/ux200lt1_nb_02_i?$dw_temp_default_gallery$,The Minimus 200 trainer is a unisex style designed to help you get more out of your training. ,['Castlerock_with_Black'],New Balance 200 Trainer,$129.99
New Balance,training,http://nb.scene7.com/is/image/NB/mx857ch2_nb_02_i?$dw_temp_default_gallery$,"DRI-EX® lining helps wick moisture, while a durable suede upper keeps your look classic in and out of the gym.",['CharcoalBlue'],Mens New Balance 857v2 Suede,$129.99
New Balance,training,http://nb.scene7.com/is/image/NB/mxqikab3_nb_02_i?$dw_temp_default_gallery$,Your most intense workouts go smoother with the lightweight comfort and superior traction of the FuelCore Quick v3 men’s trainer.,"['Black_with_White', 'Black_with_HiLite']",FuelCore Quick v3 Trainer,$89.99
New Balance,training,http://nb.scene7.com/is/image/NB/mx608mk4_nb_02_i?$dw_temp_default_gallery$,"The leather look you want meets the support and cushioning you need in the New Balance 608v4. You’ll love the full-length comfort of the premium ABZORB cushioning, the dual-density collar foam that helps prevent irritation at your ankles, and the flexible outsole that helps you move more freely.","['Black', 'Brown_with_Black']",Mens 608v4,$74.99
New Balance,training,http://nb.scene7.com/is/image/NB/mx824bb1_nb_02_i?$dw_temp_default_gallery$,No-sew overlays and stretchy shoe laces add an extra layer of comfort and performance to this men's trainer.,"['Black_with_Silver', 'White_with_Black_and_PlacidBlue']",New Balance 824 Trainer,$89.99
New Balance,training,http://nb.scene7.com/is/image/NB/mx818bk2_nb_02_i?$dw_temp_default_gallery$,818v2 features a CUSH+ midsole with movement-enhancing flex grooves to provide outstanding comfort while promoting more natural movement. ,['Black_with_White_and_Outerspace'],New Balance 818v2 Trainer,$64.99 (reg $74.99)
New Balance,training,http://nb.scene7.com/is/image/NB/mx623od3_nb_14_i?$dw_temp_default_gallery$,ABZORB® cushioning in the midfoot provides excellent shock absorption while QUIX technology provides support during side-to-side movements.,"['Brown', 'Black', 'Charcoal', 'Navy_with_OffWhite']",New Balance 623v3 Suede Trainer,$74.99
New Balance,training,http://nb.scene7.com/is/image/NB/mx20hc6_nb_02_i?$dw_temp_default_gallery$,Enhance your routine with the Minimus 20v6 trainer's advanced comfort and low-to-the-ground feel that allows you to be in a natural stance while you train.,['Pigment_with_EnergyLime'],HOCR Minimus 20v6 Trainer,$79.99 (reg $99.99)
New Balance,training,http://nb.scene7.com/is/image/NB/mx623lt3_nb_02_i?$dw_temp_default_gallery$,"The 623v3 takes all-day comfort to an all-new level. ABZORB cushioning in the heel capsule, an IMEVA footbed and supportive collar foam make this shoe your new core training partner.",['Brown_with_Brown'],New Balance 623v3 Trainer Leather,$84.99
New Balance,training,http://nb.scene7.com/is/image/NB/mx20bg6_nb_02_i?$dw_temp_default_gallery$,Enhance your routine with the Minimus 20v6 trainer's advanced comfort and low-to-the-ground feel that allows you to be in a natural stance while you strength train.,['ElectricBlue_with_DarkDenim_and_HiLite'],Minimus 20v6 Trainer,$79.99 (reg $99.99)
New Balance,training,http://nb.scene7.com/is/image/NB/mx99wr2_nb_02_i?$dw_temp_default_gallery$,"Designed by athletes for athletes, the 99v2 Trainer features a Flexonic sole for a wide range of flexibility and FantomFit technology in the upper for a secure fit.",['White_with_ReflectiveBlack_and_Black'],New Balance 99v2 Trainer,$69.99 (reg $79.99)
New Balance,training,http://nb.scene7.com/is/image/NB/mx1267go_nb_14_i?$dw_temp_default_gallery$,"Featuring N2 cushioning, a REVlite midsole, PROBANK and QUIX technology for multi-directional movement, and a non-marking outsole, the New Balance 1267 is a lightweight, sleek cross-trainer perfect in or out of the gym.","['Grey_with_Navy', 'Black_with_Silver', 'Black_with_AcidicGreen']",New Balance 1267,$109.99 (reg $129.99)
New Balance,training,http://nb.scene7.com/is/image/NB/mx824gr1_nb_02_i?$dw_temp_default_gallery$,"Our men's 824 trainer offers the performance features you need to power through your routine. QUIX technology was designed to aid lateral movements, performance stretch laces add flexibility, and N2 technology offers low-to-the-ground cushioning that’s responsive and durable yet low-profile in execution. ",['DarkGrey_with_Red'],New Balance 824 Trainer,$89.99
New Balance,training,http://nb.scene7.com/is/image/NB/mx623us3_nb_02_i?$dw_temp_default_gallery$,"The 623v3 takes all-day comfort to an all-new level. ABZORB® cushioning in the heel capsule, an IMEVA footbed and supportive collar foam make this shoe your new core training partner.",['White_with_Navy_and_Red'],New Balance 623v3 Trainer,$69.99
New Balance,training,http://nb.scene7.com/is/image/NB/mx608v4o_nb_14_i?$dw_temp_default_gallery$,,['Brown'],Mens New Balance 608v4,$74.99
